A1: <a href="http://gvads.blue105.us/Ads/www/delivery/ck.php?n=a0254c5c" target="_blank"><img src="http://gvads.blue105.us/Ads/www/delivery/avw.php?zoneid=97&source=TopBanner&n=a0254c5c" border="0" alt="" /></a>
A2: Home Site Directory - Everything in One Place Site Map Global-View D.O.G. Index Member Directory FAQ Contact Us Blog Contributions (approved posters only) Logout BROKERS Broker Comparisons Broker Directory How to Choose a Broker FORUMS Links to All Forums Forum Registration Product Logins GVI FOREX Login GVI+Live Forex Rates Gen dk Login GVI Forex NO COST OPTION Tools Guide to Tools FX Database FX Chart Points Risk/Carry Trade Chart Points Economic Calendar QUICKLINKS FXLinks.com DAILY Forex Forecasts Exclusive Calculators...SEE SELECTIONS => Fibonacci Calculator Futures Calculator IMM Swaps Currency Converter Interest Rate Forecasts...SEE SELECTIONS => Central Bank Rate Forecasts Daily Summary Page Interest Rate Forecasts -GVI Chart Profile: Australia and RBA -GVI Preview: Bank of Canada -GVI Chart Profile: Japan and BOJ -GVI Chart Profile: U.K. and BOE -GVI Chart Profile: Eurozone amd ECB -GVI Preview: Swiss National Bank -GVI Preview: U.S. Federal Reserve Live Rates-Charts FX Database Live Rates Various Markets Live Forex Charts Live USDX Chart Daily USDX Chart Daily USDX vs. S&P Chart USDX info and Weightings Chart Gallery Market Tracker Free Trials Forex Signals Directory GVI Forex Gen dk Signals FX Trek Real-Time Charting Financial Market Signals Max McKegg Forex Trading Forecasts Trade The News Learn Learning Center Forum: Learning/Help by Experts Basics of Trading Course (Free Videos) Forex Trading Course (Free Videos) Forex Trading Handbook News Blog Latest News Blog Headlines NEW FEATURE-- News of the Day Retail Forex Traders Association Thoughts From the Forex Trenches - Newsletter Free FX News News Story Archive...SEE SELECTIONS =>.. 2010 Forex News Archive 2009 Forex News Archive 2008 Forex News Archive 2007 Forex News Archive 2006 Forex News Archive 2005 Forex News Archive 2004 Forex News Archive RSS News Feed ... News Blog Contributions (approved posters only) Jobs Jobs USA Jobs UK Jobs Canada Search qm_create(0,false,0,500,false,false,false,false,false);
A3: User Name: Password: Register - Lost password?
A4: <a href='http://gvads.blue105.us/Ads/www/delivery/ck.php?n=aa5f9793' target='_blank'><img src='http://gvads.blue105.us/Ads/www/delivery/avw.php?zoneid=96&amp;source=LeftSidebar&amp;n=aa5f9793' border='0' alt='' /></a> <!--//<![CDATA[ var m3_u = (location.protocol=='https:'?'https://gvads.blue105.us/Ads/www/delivery/ajs.php':'http://gvads.blue105.us/Ads/www/delivery/ajs.php'); var m3_r = Math.floor(Math.random()*99999999999); if (!document.MAX_used) document.MAX_used = ','; document.write ("<scr"+"ipt type='text/javascript' src='"+m3_u); document.write ("?zoneid=131"); document.write ('&amp;cb=' + m3_r); if (document.MAX_used != ',') document.write ("&amp;exclude=" + document.MAX_used); document.write (document.charset ? '&amp;charset='+document.charset : (document.characterSet ? '&amp;charset='+document.characterSet : '')); document.write ("&amp;loc=" + escape(window.location)); if (document.referrer) document.write ("&amp;referer=" + escape(document.referrer)); if (document.context) document.write ("&context=" + escape(document.context)); if (document.mmm_fo) document.write ("&amp;mmm_fo=1"); document.write ("'><\/scr"+"ipt>"); //]]>--> <!--//<![CDATA[ var m3_u = (location.protocol=='https:'?'https://gvads.blue105.us/Ads/www/delivery/ajs.php':'http://gvads.blue105.us/Ads/www/delivery/ajs.php'); var m3_r = Math.floor(Math.random()*99999999999); if (!document.MAX_used) document.MAX_used = ','; document.write ("<scr"+"ipt type='text/javascript' src='"+m3_u); document.write ("?zoneid=94"); document.write ('&amp;cb=' + m3_r); if (document.MAX_used != ',') document.write ("&amp;exclude=" + document.MAX_used); document.write (document.charset ? '&amp;charset='+document.charset : (document.characterSet ? '&amp;charset='+document.characterSet : '')); document.write ("&amp;loc=" + escape(window.location)); if (document.referrer) document.write ("&amp;referer=" + escape(document.referrer)); if (document.context) document.write ("&context=" + escape(document.context)); if (document.mmm_fo) document.write ("&amp;mmm_fo=1"); document.write ("'><\/scr"+"ipt>"); //]]>--> Market Tracker | B4: Global-View.com Privacy Policy Global-View.com respects your privacy. This statement of our Privacy Policy explains what information we gather from you and how we use that information. We consider the information you have shared with us strictly confidential and will use that information only as specified in this Privacy Policy or to the extent necessary to comply with applicable law. Information We Gather and How We Use It We collect certain information from you in order to provide you with the most interesting and useful Web site possible. We use your IP address to identify you, to gather demographic information that helps us understand how you and our other customers use our Web site, and to administer our Web site. Our registration form requires you to give us contact information (e.g. name and email address), demographic information (e.g. country). We use your contact information to contact you about our Web site and provide you with information and promotional material from our partners and advertisers. From time to time we may supplement information that you provide to us with information received from third parties. Information We May Disclose We share demographic, profile and other general information about you and our other customers with our advertisers on an aggregate basis. This means that we tell our advertisers general information about the characteristics of our customer base (e.g. geographical). Our advertisers may ask us to mail or e-mail you promotional information tailored to your interests. We will send you this information on behalf of our advertisers. From time to time we may use third parties (pursuant to a confidentiality agreement) to assist us in e-mail broadcasts and list management. You may opt-out of receiving these mailings as explained below under the heading "Your Options." We may release your contact and other information to third parties when we believe that such release is reasonably necessary to (i) comply with law, (ii) cooperate with state and federal regulatory agency investigations, (iii) enforce the terms of our User Agreement or License Agreement, or (v) protect the rights of Global-View.com or others. Cookies Our Web site uses "cookies" which deposit certain record keeping information in your hard drive. We use cookies to save your password so you don't have to re-enter it each time you visit our site, keep track of your preferences, deliver content specific to your interests, and for other similar purposes. These cookies can't read other data from your hard drive or read cookie files created by other sites or applications. Our Web site contains display ads sold by us or by outside advertising agencies. These ads may contain cookies which will be deposited in your hard drive if you click on the ads. Information generated from cookies deposited on your hard drive by our advertisers is collected by our advertisers and we do not have access to this information. Most browsers are set to accept cookies unless you reconfigure your browser to refuse them or to notify you when you have received one. If you do not accept cookies, you will not be able to use certain features of our site. Subscriptions and Purchases You may subscribe for a fee to certain services through our Web site. Any financial information we collect will be used solely to bill you for the services and items you have purchased and to ship items to you. Public Forums Forums are available to you through our Web site. Please remember that any information disclosed in these areas becomes public information. If you post personal information online that is accessible to the public, you may receive unsolicited responses. You should exercise caution when deciding to disclose any of your personal information in a public forum. Security Our Web site has certain security measures in place in effort to protect the loss, misuse and alteration of the information under our control. Links to Other Web Sites Our Web site contains links to other sites. Global-View.com is not responsible for the privacy practices or the content of such sites. You may wish to review the privacy policies of these sites. Third Party Advertising We use some third-party advertising companies to serve ads when you visit our Web site. These companies may use information (not including your name, address, email address or telephone number) about your visits to this and other Web sites in order to provide advertisements on this site and other sites about goods and services that may be of interest to you. If you would like more information about this practice and to know your choices about not having this information used by these companies, please click here Third Party Cookies In the course of serving advertisements to this site, our third-party advertiser may place or recognize a unique 'cookie' on your browser. Your Options Opting to not receive promotional materials from our advertisers or messages from Global-View.com You may opt-out during the registration process or after registering by visiting us at http://www.global-view.com and using the contact us link to contact us. Every e-mail we send to you will provide you with instructions on how to unsubscribe so that you will not receive any future e-mails. Correct or Update Your Information You may correct or update any information previously provided to us by visiting us at http:/www.global-view.com and using the contact us link to contact us. Contacting Us If you have any questions about this privacy statement, the practices of this site, or your dealings with this Web site, you can contact Web Site Administrator news@global-view.com Additional Information For general information about Internet privacy issues, you may wish to visit the Web site hosted by the Federal Trade Commission at http://www.ftc.gov/privacy. We may from time to time revise this Privacy Policy. This statement of our Privacy Policy was last revised on March 31, 2009 | C4: <a href='http://gvads.blue105.us/Ads/www/delivery/ck.php?n=a3685c3d' target='_blank'><img src='http://gvads.blue105.us/Ads/www/delivery/avw.php?zoneid=141&amp;source=RigthSideBar&amp;n=a3685c3d' border='0' alt='' /></a> <a href='http://gvads.blue105.us/Ads/www/delivery/ck.php?n=a045e000' target='_blank'><img src='http://gvads.blue105.us/Ads/www/delivery/avw.php?zoneid=158&amp;source=RightSidebar&amp;n=a045e000' border='0' alt='' /></a>

A1: 40849.39155925926
A2: Target | C2: 3-Mo
A3: 4.50 | B3: Aust | C3: 4.7275
A4: 0.10 | B4: Japan | C4: 0.19475000000000001
A5: 0.50 | B5: U.K. | C5: 0.98868999999999996
A6: 1.50 | B6: E-Z | C6: 1.585
A7: 0.00 | B7: Switz | C7: 4.3330000000000007E-2
A8: 1.00 | B8: Cda | C8: 1.2749999999999999
A9: 0.13 | B9: U.S. | C9: 0.43167000000000011
A11: 2-YR | B11: % | C11: bp chg
A12: Aust | B12: 3.7069999999999999 | C12: 2.5
A13: Japan | B13: 0.15 | C13: -0.5
A14: U.K. | B14: 0.56499999999999995 | C14: 1.5
A15: E-Z | B15: 0.45600000000000002 | C15: 3.7
A16: Switz | B16: 7.2000000000000008E-2 | C16: 9.6
A17: Cda | B17: 0.96599999999999997 | C17: 4.3999999999999915
A18: U.S. | B18: 0.2382 | C18: 0
A20: 10-YR | B20: % | C20: bp chg
A21: Aust | B21: 4.298 | C21: 2
A22: Japan | B22: 1.00 | C22: -3
A23: U.K. | B23: 2.274 | C23: 2.9000000000000057
A24: E-Z | B24: 1.83 | C24: 5.0999999999999943
A25: Switz | B25: 0.93500000000000005 | C25: 1.5999999999999943
A26: Cda | B26: 2.222 | C26: 6
A27: U.S. | B27: 2.0505 | C27: 6.8600000000000136

A1: <a href="http://gvads.blue105.us/Ads/www/delivery/ck.php?n=a052e129" target="_blank"> <img alt="" border="0" src="http://gvads.blue105.us/Ads/www/delivery/avw.php?zoneid=19&amp;source=TopAdBtnBelowBanner&amp;n=a052e129" /> </a> | B1: <a href="http://gvads.blue105.us/Ads/www/delivery/ck.php?n=abd5a77b" target="_blank"> <img alt="" border="0" src="http://gvads.blue105.us/Ads/www/delivery/avw.php?zoneid=20&amp;source=TopAdBtnBelowBanner&amp;n=abd5a77b" /> </a>
A2: <a href="http://gvads.blue105.us/Ads/www/delivery/ck.php?n=a1a8bcbd" target="_blank"> <img alt="" border="0" src="http://gvads.blue105.us/Ads/www/delivery/avw.php?zoneid=21&amp;source=TopAdBtnBelowBanner&amp;n=a1a8bcbd" /> </a> | B2: <a href="http://gvads.blue105.us/Ads/www/delivery/ck.php?n=a243546e" target="_blank"> <img alt="" border="0" src="http://gvads.blue105.us/Ads/www/delivery/avw.php?zoneid=22&amp;source=TopAdBtnBelowBanner&amp;n=a243546e" /> </a>

A3: <!--//<![CDATA[ var m3_u = (location.protocol=='https:'?'https://gvads.blue105.us/Ads/www/delivery/ajs.php':'http://gvads.blue105.us/Ads/www/delivery/ajs.php'); var m3_r = Math.floor(Math.random()*99999999999); if (!document.MAX_used) document.MAX_used = ','; document.write ("<scr"+"ipt type='text/javascript' src='"+m3_u); document.write ("?zoneid=152"); document.write ('&amp;cb=' + m3_r); if (document.MAX_used != ',') document.write ("&amp;exclude=" + document.MAX_used); document.write (document.charset ? '&amp;charset='+document.charset : (document.characterSet ? '&amp;charset='+document.characterSet : '')); document.write ("&amp;loc=" + escape(window.location)); if (document.referrer) document.write ("&amp;referer=" + escape(document.referrer)); if (document.context) document.write ("&context=" + escape(document.context)); if (document.mmm_fo) document.write ("&amp;mmm_fo=1"); document.write ("'><\/scr"+"ipt>"); //]]>-->
A4: <a href='http://gvads.blue105.us/Ads/www/delivery/ck.php?n=a46d824e&amp;cb=INSERT_RANDOM_NUMBER_HERE' target='_blank'> <img src='http://gvads.blue105.us/Ads/www/delivery/avw.php?zoneid=137&amp;cb=INSERT_RANDOM_NUMBER_HERE&amp;n=a46d824e' border='0' alt='' /></a>
A5: <!--table {mso-displayed-decimal-separator:"\."; mso-displayed-thousand-separator:"\,";} .font528037 {color:black; font-size:8.0pt; font-weight:400; font-style:normal; text-decoration:none; font-family:Tahoma; mso-generic-font-family:auto; mso-font-charset:0;} .font628037 {color:black; font-size:8.0pt; font-weight:700; font-style:normal; text-decoration:none; font-family:Tahoma; mso-generic-font-family:auto; mso-font-charset:0;} .xl1528037 {padding:0px; mso-ignore:padding; color:windowtext; font-size:10.0pt; font-weight:400; font-style:normal; text-decoration:none; font-family:Arial; mso-generic-font-family:auto; mso-font-charset:0; mso-number-format:General; text-align:general; vertical-align:bottom; mso-background-source:auto; mso-pattern:auto; white-space:nowrap;} .xl2628037 {padding:0px; mso-ignore:padding; color:windowtext; font-size:8.0pt; font-weight:400; font-style:normal; text-decoration:none; font-family:Arial, sans-serif; mso-font-charset:0; mso-number-format:Fixed; text-align:center; vertical-align:bottom; mso-background-source:auto; mso-pattern:auto; white-space:nowrap;} .xl2728037 {padding:0px; mso-ignore:padding; color:windowtext; font-size:8.0pt; font-weight:400; font-style:normal; text-decoration:none; font-family:Arial, sans-serif; mso-font-charset:0; mso-number-format:"0\.0000"; text-align:center; vertical-align:bottom; mso-background-source:auto; mso-pattern:auto; white-space:nowrap;} .xl2828037 {padding:0px; mso-ignore:padding; color:windowtext; font-size:8.0pt; font-weight:400; font-style:normal; text-decoration:none; font-family:Arial, sans-serif; mso-font-charset:0; mso-number-format:"\[ENG\]\[$-409\]dd\\-mmm\\-yy\;\@"; text-align:center; vertical-align:bottom; background:#CCFFFF; mso-pattern:auto none; white-space:nowrap;} .xl2928037 {padding:0px; mso-ignore:padding; color:windowtext; font-size:8.0pt; font-weight:400; font-style:normal; text-decoration:none; font-family:Arial, sans-serif; mso-font-charset:0; mso-number-format:"0\.0000"; text-align:center; vertical-align:bottom; background:#FFFFCC; mso-pattern:auto none; white-space:nowrap;} .xl3028037 {padding:0px; mso-ignore:padding; color:windowtext; font-size:8.0pt; font-weight:400; font-style:normal; text-decoration:none; font-family:Arial, sans-serif; mso-font-charset:0; mso-number-format:Fixed; text-align:center; vertical-align:bottom; background:#FFFFCC; mso-pattern:auto none; white-space:nowrap;} .xl3128037 {padding:0px; mso-ignore:padding; color:windowtext; font-size:7.0pt; font-weight:400; font-style:normal; text-decoration:none; font-family:Arial, sans-serif; mso-font-charset:0; mso-number-format:"\[ENG\]\[$-409\]d\\-mmm\\-yy\;\@"; text-align:center; vertical-align:bottom; background:#CCFFFF; mso-pattern:auto none; white-space:nowrap;} .xl3228037 {padding:0px; mso-ignore:padding; color:blue; font-size:8.0pt; font-weight:400; font-style:normal; text-decoration:underline; text-underline-style:single; font-family:Arial, sans-serif; mso-font-charset:0; mso-number-format:General; text-align:center; vertical-align:bottom; border-top:none; border-right:.5pt solid windowtext; border-bottom:.5pt solid windowtext; border-left:.5pt solid windowtext; background:#CCFFFF; mso-pattern:auto none; white-space:nowrap;} .xl3328037 {padding:0px; mso-ignore:padding; color:blue; font-size:8.0pt; font-weight:400; font-style:normal; text-decoration:underline; text-underline-style:single; font-family:Arial, sans-serif; mso-font-charset:0; mso-number-format:General; text-align:center; vertical-align:bottom; border-top:none; border-right:.5pt solid windowtext; border-bottom:.5pt solid windowtext; border-left:none; background:#CCFFFF; mso-pattern:auto none; white-space:nowrap;} --> Source: Global-View FX Database
A6: <!--//<![CDATA[ var m3_u = (location.protocol=='https:'?'https://gvads.blue105.us/Ads/www/delivery/ajs.php':'http://gvads.blue105.us/Ads/www/delivery/ajs.php'); var m3_r = Math.floor(Math.random()*99999999999); if (!document.MAX_used) document.MAX_used = ','; document.write ("<scr"+"ipt type='text/javascript' src='"+m3_u); document.write ("?zoneid=153"); document.write ('&amp;cb=' + m3_r); if (document.MAX_used != ',') document.write ("&amp;exclude=" + document.MAX_used); document.write (document.charset ? '&amp;charset='+document.charset : (document.characterSet ? '&amp;charset='+document.characterSet : '')); document.write ("&amp;loc=" + escape(window.location)); if (document.referrer) document.write ("&amp;referer=" + escape(document.referrer)); if (document.context) document.write ("&context=" + escape(document.context)); if (document.mmm_fo) document.write ("&amp;mmm_fo=1"); document.write ("'><\/scr"+"ipt>"); //]]>-->

A1: <!--//<![CDATA[ var m3_u = (location.protocol=='https:'?'https://gvads.blue105.us/Ads/www/delivery/ajs.php':'http://gvads.blue105.us/Ads/www/delivery/ajs.php'); var m3_r = Math.floor(Math.random()*99999999999); if (!document.MAX_used) document.MAX_used = ','; document.write ("<scr"+"ipt type='text/javascript' src='"+m3_u); document.write ("?zoneid=167"); document.write ('&amp;cb=' + m3_r); if (document.MAX_used != ',') document.write ("&amp;exclude=" + document.MAX_used); document.write (document.charset ? '&amp;charset='+document.charset : (document.characterSet ? '&amp;charset='+document.characterSet : '')); document.write ("&amp;loc=" + escape(window.location)); if (document.referrer) document.write ("&amp;referer=" + escape(document.referrer)); if (document.context) document.write ("&context=" + escape(document.context)); if (document.mmm_fo) document.write ("&amp;mmm_fo=1"); document.write ("'><\/scr"+"ipt>"); //]]>-->

A1: Test Drive a Better Broker NEW! Global-View best brokers list section. ASK US. for info. Broker Directory Broker Comparisons How to Choose FX Broker News Best Brokers List

A1: 11/1/2011 | B1: EURUSD | C1: USDJPY | D1: USDCHF | E1: GBPUSD | F1: USDCAD
A2: Close | B2: 1.3677999999999999 | C2: 78.35 | D2: 0.8881 | E2: 1.5931 | F2: 1.0192999999999999
A3: High | B3: 1.3871 | C3: 78.61 | D3: 0.89590000000000003 | E3: 1.6093 | F3: 1.0206999999999999
A4: Low | B4: 1.3608 | C4: 77.99 | D4: 0.87600000000000011 | E4: 1.5889 | F4: 0.997
A5: Mov avgs | B5: EURUSD | C5: USDJPY | D5: USDCHF | E5: GBPUSD | F5: USDCAD
A6: 5 day | B6: 1.3952800000000001 | C6: 76.89200000000001 | D6: 0.87381999999999993 | E6: 1.60368 | F6: 1.00098
A7: 10 day | B7: 1.3899899999999998 | C7: 76.621000000000009 | D7: 0.8807600000000001 | E7: 1.5967600000000002 | F7: 1.0067900000000001
A8: 20 day | B8: 1.37747 | C8: 76.73 | D8: 0.89327000000000023 | E8: 1.5812249999999999 | F8: 1.0160700000000003
A9: 50 day | B9: 1.3824099999999999 | C9: 76.797800000000009 | D9: 0.87504800000000016 | E9: 1.5842559999999992 | F9: 1.0073079999999999
A10: 100 day | B10: 1.4060300000000001 | C10: 77.816700000000026 | D10: 0.8423029999999998 | E10: 1.602545000000001 | F10: 0.98841199999999962
A11: 200 day | B11: 1.4101519999999999 | C11: 79.870499999999964 | D11: 0.87273349999999994 | E11: 1.6138079999999999 | F11: 0.98098300000000127
A12: Pivots | B12: =SUM(B2:B4)/3 -> 1.3719000000000001 | C12: =SUM(C2:C4)/3 -> 78.316666666666663 | D12: =SUM(D2:D4)/3 -> 0.88666666666666671 | E12: =SUM(E2:E4)/3 -> 1.5971 | F12: =SUM(F2:F4)/3 -> 1.0123333333333333

A1: <!--table {mso-displayed-decimal-separator:"\."; mso-displayed-thousand-separator:"\,";} .xl156153 {padding:0px; mso-ignore:padding; color:windowtext; font-size:10.0pt; font-weight:400; font-style:normal; text-decoration:none; font-family:Arial; mso-generic-font-family:auto; mso-font-charset:0; mso-number-format:General; text-align:general; vertical-align:bottom; mso-background-source:auto; mso-pattern:auto; white-space:nowrap;} .xl256153 {padding:0px; mso-ignore:padding; color:windowtext; font-size:8.0pt; font-weight:400; font-style:normal; text-decoration:none; font-family:Arial, sans-serif; mso-font-charset:0; mso-number-format:"0\;\[Red\]0"; text-align:center; vertical-align:bottom; border-top:none; border-right:.5pt solid silver; border-bottom:.5pt solid silver; border-left:none; mso-background-source:auto; mso-pattern:auto; white-space:nowrap;} .xl266153 {padding:0px; mso-ignore:padding; color:windowtext; font-size:8.0pt; font-weight:400; font-style:normal; text-decoration:none; font-family:Arial, sans-serif; mso-font-charset:0; mso-number-format:"0_\)\;\[Red\]\\\(0\\\)"; text-align:center; vertical-align:bottom; border-top:none; border-right:.5pt solid silver; border-bottom:.5pt solid silver; border-left:none; mso-background-source:auto; mso-pattern:auto; white-space:nowrap;} .xl276153 {padding:0px; mso-ignore:padding; color:windowtext; font-size:10.0pt; font-weight:400; font-style:normal; text-decoration:none; font-family:Arial; mso-generic-font-family:auto; mso-font-charset:0; mso-number-format:General; text-align:center; vertical-align:bottom; mso-background-source:auto; mso-pattern:auto; white-space:nowrap;} .xl286153 {padding:0px; mso-ignore:padding; color:windowtext; font-size:8.0pt; font-weight:400; font-style:normal; text-decoration:none; font-family:Arial; mso-generic-font-family:auto; mso-font-charset:0; mso-number-format:General; text-align:center; vertical-align:bottom; mso-background-source:auto; mso-pattern:auto; white-space:nowrap;} .xl296153 {padding:0px; mso-ignore:padding; color:windowtext; font-size:8.0pt; font-weight:400; font-style:normal; text-decoration:none; font-family:Arial, sans-serif; mso-font-charset:0; mso-number-format:0; text-align:center; vertical-align:bottom; background:white; mso-pattern:auto none; white-space:nowrap;} .xl306153 {padding:0px; mso-ignore:padding; color:windowtext; font-size:8.0pt; font-weight:400; font-style:normal; text-decoration:none; font-family:Arial, sans-serif; mso-font-charset:0; mso-number-format:"0\;\[Red\]0"; text-align:center; vertical-align:bottom; background:white; mso-pattern:auto none; white-space:nowrap;} .xl316153 {padding:0px; mso-ignore:padding; color:windowtext; font-size:8.0pt; font-weight:400; font-style:normal; text-decoration:none; font-family:Arial, sans-serif; mso-font-charset:0; mso-number-format:"0\.0000"; text-align:center; vertical-align:bottom; background:white; mso-pattern:auto none; white-space:nowrap;} .xl326153 {padding:0px; mso-ignore:padding; color:windowtext; font-size:8.0pt; font-weight:400; font-style:normal; text-decoration:none; font-family:Arial, sans-serif; mso-font-charset:0; mso-number-format:Fixed; text-align:center; vertical-align:bottom; background:white; mso-pattern:auto none; white-space:nowrap;} .xl336153 {padding:0px; mso-ignore:padding; color:blue; font-size:8.0pt; font-weight:400; font-style:normal; text-decoration:underline; text-underline-style:single; font-family:Arial, sans-serif; mso-font-charset:0; mso-number-format:Fixed; text-align:center; vertical-align:middle; background:white; mso-pattern:auto none; white-space:nowrap;} .xl346153 {padding:0px; mso-ignore:padding; color:windowtext; font-size:8.0pt; font-weight:400; font-style:normal; text-decoration:none; font-family:Arial, sans-serif; mso-font-charset:0; mso-number-format:0; text-align:center; vertical-align:middle; background:white; mso-pattern:auto none; white-space:nowrap;} .xl356153 {padding:0px; mso-ignore:padding; color:windowtext; font-size:8.0pt; font-weight:400; font-style:normal; text-decoration:none; font-family:Arial, sans-serif; mso-font-charset:0; mso-number-format:"0\.0000"; text-align:center; vertical-align:bottom; border-top:1.0pt dashed silver; border-right:none; border-bottom:1.0pt dashed silver; border-left:none; background:white; mso-pattern:auto none; white-space:nowrap;} .xl366153 {padding:0px; mso-ignore:padding; color:windowtext; font-size:8.0pt; font-weight:400; font-style:normal; text-decoration:none; font-family:Arial, sans-serif; mso-font-charset:0; mso-number-format:"0\;\[Red\]0"; text-align:center; vertical-align:bottom; border-top:1.0pt dashed silver; border-right:none; border-bottom:1.0pt dashed silver; border-left:none; background:white; mso-pattern:auto none; white-space:nowrap;} .xl376153 {padding:0px; mso-ignore:padding; color:blue; font-size:8.0pt; font-weight:400; font-style:normal; text-decoration:underline; text-underline-style:single; font-family:Arial, sans-serif; mso-font-charset:0; mso-number-format:Fixed; text-align:center; vertical-align:bottom; border-top:1.0pt dashed silver; border-right:none; border-bottom:1.0pt dashed silver; border-left:none; background:white; mso-pattern:auto none; white-space:nowrap;} .xl386153 {padding:0px; mso-ignore:padding; color:windowtext; font-size:8.0pt; font-weight:400; font-style:normal; text-decoration:none; font-family:Arial, sans-serif; mso-font-charset:0; mso-number-format:0; text-align:center; vertical-align:bottom; border-top:1.0pt dashed silver; border-right:none; border-bottom:1.0pt dashed silver; border-left:none; background:white; mso-pattern:auto none; white-space:nowrap;} .xl396153 {padding:0px; mso-ignore:padding; color:windowtext; font-size:8.0pt; font-weight:400; font-style:normal; text-decoration:none; font-family:Arial, sans-serif; mso-font-charset:0; mso-number-format:Fixed; text-align:center; vertical-align:bottom; border-top:1.0pt dashed silver; border-right:none; border-bottom:1.0pt dashed silver; border-left:none; background:white; mso-pattern:auto none; white-space:nowrap;} .xl406153 {padding:0px; mso-ignore:padding; color:windowtext; font-size:8.0pt; font-weight:400; font-style:normal; text-decoration:none; font-family:Arial, sans-serif; mso-font-charset:0; mso-number-format:"0\;\[Red\]0"; text-align:center; vertical-align:bottom; border-top:none; border-right:.5pt solid silver; border-bottom:none; border-left:none; background:white; mso-pattern:auto none; white-space:nowrap;} .xl416153 {padding:0px; mso-ignore:padding; color:windowtext; font-size:8.0pt; font-weight:400; font-style:normal; text-decoration:none; font-family:Arial, sans-serif; mso-font-charset:0; mso-number-format:"0\;\[Red\]0"; text-align:center; vertical-align:bottom; border-top:1.0pt dashed silver; border-right:.5pt solid silver; border-bottom:1.0pt dashed silver; border-left:none; background:white; mso-pattern:auto none; white-space:nowrap;} .xl426153 {padding:0px; mso-ignore:padding; color:windowtext; font-size:8.0pt; font-weight:400; font-style:normal; text-decoration:none; font-family:Arial; mso-generic-font-family:auto; mso-font-charset:0; mso-number-format:Fixed; text-align:center; vertical-align:bottom; background:white; mso-pattern:auto none; white-space:nowrap;} .xl436153 {padding:0px; mso-ignore:padding; color:windowtext; font-size:8.0pt; font-weight:400; font-style:normal; text-decoration:none; font-family:Arial; mso-generic-font-family:auto; mso-font-charset:0; mso-number-format:"0\;\[Red\]0"; text-align:center; vertical-align:bottom; background:white; mso-pattern:auto none; white-space:nowrap;} .xl446153 {padding:0px; mso-ignore:padding; color:windowtext; font-size:8.0pt; font-weight:400; font-style:normal; text-decoration:none; font-family:Arial; mso-generic-font-family:auto; mso-font-charset:0; mso-number-format:"0\.0000"; text-align:center; vertical-align:bottom; background:white; mso-pattern:auto none; white-space:nowrap;} .xl456153 {padding:0px; mso-ignore:padding; color:windowtext; font-size:10.0pt; font-weight:400; font-style:normal; text-decoration:none; font-family:Arial; mso-generic-font-family:auto; mso-font-charset:0; mso-number-format:General; text-align:center; vertical-align:bottom; background:#CCFFFF; mso-pattern:auto none; white-space:nowrap;} .xl466153 {padding:0px; mso-ignore:padding; color:windowtext; font-size:8.0pt; font-weight:400; font-style:normal; text-decoration:none; font-family:Arial; mso-generic-font-family:auto; mso-font-charset:0; mso-number-format:General; text-align:center; vertical-align:bottom; background:#CCFFFF; mso-pattern:auto none; white-space:nowrap;} .xl476153 {padding:0px; mso-ignore:padding; color:windowtext; font-size:8.0pt; font-weight:400; font-style:normal; text-decoration:none; font-family:Arial; mso-generic-font-family:auto; mso-font-charset:0; mso-number-format:0; text-align:center; vertical-align:bottom; background:#CCFFFF; mso-pattern:auto none; white-space:nowrap;} .xl486153 {padding:0px; mso-ignore:padding; color:windowtext; font-size:8.0pt; font-weight:400; font-style:normal; text-decoration:none; font-family:Arial, sans-serif; mso-font-charset:0; mso-number-format:0; text-align:center; vertical-align:bottom; background:#CCFFFF; mso-pattern:auto none; white-space:nowrap;} .xl496153 {padding:0px; mso-ignore:padding; color:windowtext; font-size:8.0pt; font-weight:400; font-style:normal; text-decoration:none; font-family:Arial, sans-serif; mso-font-charset:0; mso-number-format:Fixed; text-align:center; vertical-align:bottom; background:#CCFFFF; mso-pattern:auto none; white-space:nowrap;} .xl506153 {padding:0px; mso-ignore:padding; color:windowtext; font-size:8.0pt; font-weight:700; font-style:normal; text-decoration:none; font-family:Arial, sans-serif; mso-font-charset:0; mso-number-format:Fixed; text-align:center; vertical-align:bottom; background:#CCFFFF; mso-pattern:auto none; white-space:nowrap;} .xl516153 {padding:0px; mso-ignore:padding; color:windowtext; font-size:8.0pt; font-weight:700; font-style:normal; text-decoration:none; font-family:Arial, sans-serif; mso-font-charset:0; mso-number-format:Fixed; text-align:center; vertical-align:bottom; border-top:none; border-right:.5pt solid silver; border-bottom:none; border-left:none; background:#CCFFFF; mso-pattern:auto none; white-space:nowrap;} .xl526153 {padding:0px; mso-ignore:padding; color:blue; font-size:8.0pt; font-weight:400; font-style:normal; text-decoration:underline; text-underline-style:single; font-family:Arial, sans-serif; mso-font-charset:0; mso-number-format:Fixed; text-align:center; vertical-align:bottom; background:#CCFFFF; mso-pattern:auto none; white-space:nowrap;} .xl536153 {padding:0px; mso-ignore:padding; color:blue; font-size:8.0pt; font-weight:400; font-style:normal; text-decoration:underline; text-underline-style:single; font-family:Arial, sans-serif; mso-font-charset:0; mso-number-format:Fixed; text-align:center; vertical-align:bottom; border-top:1.0pt dashed silver; border-right:none; border-bottom:1.0pt dashed silver; border-left:none; background:#CCFFFF; mso-pattern:auto none; white-space:nowrap;} .xl546153 {padding:0px; mso-ignore:padding; color:blue; font-size:8.0pt; font-weight:400; font-style:normal; text-decoration:underline; text-underline-style:single; font-family:Arial, sans-serif; mso-font-charset:0; mso-number-format:Fixed; text-align:center; vertical-align:bottom; border-top:1.0pt dashed silver; border-right:none; border-bottom:1.0pt dashed silver; border-left:.5pt solid silver; background:#CCFFFF; mso-pattern:auto none; white-space:nowrap;} .xl556153 {padding:0px; mso-ignore:padding; color:blue; font-size:8.0pt; font-weight:400; font-style:normal; text-decoration:underline; text-underline-style:single; font-family:Arial, sans-serif; mso-font-charset:0; mso-number-format:Fixed; text-align:center; vertical-align:bottom; border-top:none; border-right:none; border-bottom:none; border-left:.5pt solid silver; background:#CCFFFF; mso-pattern:auto none; white-space:nowrap;} .xl566153 {padding:0px; mso-ignore:padding; color:windowtext; font-size:8.0pt; font-weight:400; font-style:normal; text-decoration:none; font-family:Arial, sans-serif; mso-font-charset:0; mso-number-format:General; text-align:center; vertical-align:middle; background:#CCFFFF; mso-pattern:auto none; white-space:nowrap;} .xl576153 {padding:0px; mso-ignore:padding; color:blue; font-size:8.0pt; font-weight:400; font-style:normal; text-decoration:underline; text-underline-style:single; font-family:Arial; mso-generic-font-family:auto; mso-font-charset:0; mso-number-format:Fixed; text-align:center; vertical-align:bottom; background:#CCFFFF; mso-pattern:auto none; white-space:nowrap;} .xl586153 {padding:0px; mso-ignore:padding; color:blue; font-size:8.0pt; font-weight:400; font-style:normal; text-decoration:underline; text-underline-style:single; font-family:Arial; mso-generic-font-family:auto; mso-font-charset:0; mso-number-format:Fixed; text-align:center; vertical-align:bottom; border-top:none; border-right:none; border-bottom:.5pt solid silver; border-left:none; background:#CCFFFF; mso-pattern:auto none; white-space:nowrap;} .xl596153 {padding:0px; mso-ignore:padding; color:blue; font-size:8.0pt; font-weight:400; font-style:normal; text-decoration:underline; text-underline-style:single; font-family:Arial; mso-generic-font-family:auto; mso-font-charset:0; mso-number-format:Fixed; text-align:center; vertical-align:bottom; border-top:none; border-right:none; border-bottom:none; border-left:.5pt solid silver; background:#CCFFFF; mso-pattern:auto none; white-space:nowrap;} .xl606153 {padding:0px; mso-ignore:padding; color:windowtext; font-size:8.0pt; font-weight:400; font-style:normal; text-decoration:none; font-family:Arial, sans-serif; mso-font-charset:0; mso-number-format:General; text-align:center; vertical-align:bottom; background:#CCFFFF; mso-pattern:auto none; white-space:nowrap;} .xl616153 {padding:0px; mso-ignore:padding; color:windowtext; font-size:8.0pt; font-weight:700; font-style:normal; text-decoration:none; font-family:Arial, sans-serif; mso-font-charset:0; mso-number-format:General; text-align:center; vertical-align:middle; background:#CCFFFF; mso-pattern:auto none; white-space:nowrap;} .xl626153 {padding:0px; mso-ignore:padding; color:windowtext; font-size:8.0pt; font-weight:700; font-style:normal; text-decoration:none; font-family:Arial, sans-serif; mso-font-charset:0; mso-number-format:"h\:mm\;\@"; text-align:center; vertical-align:bottom; border-top:none; border-right:none; border-bottom:none; border-left:.5pt solid silver; background:#CCFFFF; mso-pattern:auto none; white-space:nowrap;} .xl636153 {padding:0px; mso-ignore:padding; color:windowtext; font-size:8.0pt; font-weight:700; font-style:normal; text-decoration:none; font-family:Arial, sans-serif; mso-font-charset:0; mso-number-format:General; text-align:center; vertical-align:bottom; background:#CCFFFF; mso-pattern:auto none; white-space:nowrap;} .xl646153 {padding:0px; mso-ignore:padding; color:windowtext; font-size:10.0pt; font-weight:400; font-style:normal; text-decoration:none; font-family:Arial; mso-generic-font-family:auto; mso-font-charset:0; mso-number-format:General; text-align:center; vertical-align:bottom; border-top:none; border-right:none; border-bottom:none; border-left:.5pt solid silver; background:#CCFFFF; mso-pattern:auto none; white-space:nowrap;} .xl656153 {padding:0px; mso-ignore:padding; color:windowtext; font-size:8.0pt; font-weight:400; font-style:normal; text-decoration:none; font-family:Arial; mso-generic-font-family:auto; mso-font-charset:0; mso-number-format:General; text-align:center; vertical-align:bottom; border-top:none; border-right:none; border-bottom:none; border-left:.5pt solid silver; background:#CCFFFF; mso-pattern:auto none; white-space:nowrap;} .xl666153 {padding:0px; mso-ignore:padding; color:blue; font-size:8.0pt; font-weight:400; font-style:normal; text-decoration:underline; text-underline-style:single; font-family:Arial; mso-generic-font-family:auto; mso-font-charset:0; mso-number-format:Fixed; text-align:center; vertical-align:bottom; border-top:none; border-right:none; border-bottom:.5pt solid silver; border-left:.5pt solid silver; background:#CCFFFF; mso-pattern:auto none; white-space:nowrap;} .xl676153 {padding:0px; mso-ignore:padding; color:windowtext; font-size:8.0pt; font-weight:400; font-style:normal; text-decoration:none; font-family:Arial; mso-generic-font-family:auto; mso-font-charset:0; mso-number-format:"0\.0000"; text-align:center; vertical-align:bottom; mso-background-source:auto; mso-pattern:auto; white-space:nowrap;} .xl686153 {padding:0px; mso-ignore:padding; color:windowtext; font-size:8.0pt; font-weight:400; font-style:normal; text-decoration:none; font-family:Arial; mso-generic-font-family:auto; mso-font-charset:0; mso-number-format:"0\;\[Red\]0"; text-align:center; vertical-align:bottom; mso-background-source:auto; mso-pattern:auto; white-space:nowrap;} .xl696153 {padding:0px; mso-ignore:padding; color:windowtext; font-size:8.0pt; font-weight:400; font-style:normal; text-decoration:none; font-family:Arial; mso-generic-font-family:auto; mso-font-charset:0; mso-number-format:"0\.0000"; text-align:center; vertical-align:bottom; border-top:none; border-right:none; border-bottom:.5pt solid silver; border-left:none; background:white; mso-pattern:auto none; white-space:nowrap;} .xl706153 {padding:0px; mso-ignore:padding; color:windowtext; font-size:8.0pt; font-weight:400; font-style:normal; text-decoration:none; font-family:Arial; mso-generic-font-family:auto; mso-font-charset:0; mso-number-format:"0\;\[Red\]0"; text-align:center; vertical-align:bottom; border-top:none; border-right:none; border-bottom:.5pt solid silver; border-left:none; background:white; mso-pattern:auto none; white-space:nowrap;} .xl716153 {padding:0px; mso-ignore:padding; color:windowtext; font-size:8.0pt; font-weight:400; font-style:normal; text-decoration:none; font-family:Arial; mso-generic-font-family:auto; mso-font-charset:0; mso-number-format:"0\;\[Red\]0"; text-align:center; vertical-align:bottom; border-top:none; border-right:.5pt solid silver; border-bottom:none; border-left:none; background:white; mso-pattern:auto none; white-space:nowrap;} .xl726153 {padding:0px; mso-ignore:padding; color:windowtext; font-size:8.0pt; font-weight:400; font-style:normal; text-decoration:none; font-family:Arial; mso-generic-font-family:auto; mso-font-charset:0; mso-number-format:"0\.0"; text-align:center; vertical-align:bottom; background:white; mso-pattern:auto none; white-space:nowrap;} .xl736153 {padding:0px; mso-ignore:padding; color:windowtext; font-size:8.0pt; font-weight:400; font-style:normal; text-decoration:none; font-family:Arial; mso-generic-font-family:auto; mso-font-charset:0; mso-number-format:"0\.00\;\[Red\]0\.00"; text-align:center; vertical-align:bottom; border-top:none; border-right:.5pt solid silver; border-bottom:none; border-left:none; background:white; mso-pattern:auto none; white-space:nowrap;} .xl746153 {padding:0px; mso-ignore:padding; color:windowtext; font-size:8.0pt; font-weight:400; font-style:normal; text-decoration:none; font-family:Arial; mso-generic-font-family:auto; mso-font-charset:0; mso-number-format:Fixed; text-align:center; vertical-align:bottom; border-top:none; border-right:none; border-bottom:.5pt solid silver; border-left:none; background:white; mso-pattern:auto none; white-space:nowrap;} .xl756153 {padding:0px; mso-ignore:padding; color:windowtext; font-size:8.0pt; font-weight:400; font-style:normal; text-decoration:none; font-family:Arial; mso-generic-font-family:auto; mso-font-charset:0; mso-number-format:"0\.00\;\[Red\]0\.00"; text-align:center; vertical-align:bottom; border-top:none; border-right:.5pt solid silver; border-bottom:.5pt solid silver; border-left:none; background:white; mso-pattern:auto none; white-space:nowrap;} .xl766153 {padding:0px; mso-ignore:padding; color:blue; font-size:10.0pt; font-weight:700; font-style:normal; text-decoration:underline; text-underline-style:single; font-family:Arial, sans-serif; mso-font-charset:0; mso-number-format:"\[ENG\]\[$-409\]d\\-mmm\\-yy\;\@"; text-align:center; vertical-align:middle; border-top:.5pt solid silver; border-right:.5pt solid silver; border-bottom:none; border-left:none; background:#CCFFFF; mso-pattern:auto none; white-space:nowrap;} .xl776153 {padding:0px; mso-ignore:padding; color:windowtext; font-size:8.0pt; font-weight:700; font-style:normal; text-decoration:none; font-family:Arial, sans-serif; mso-font-charset:0; mso-number-format:"\[ENG\]\[$-409\]d\\-mmm\\-yy\;\@"; text-align:center; vertical-align:bottom; border-top:none; border-right:none; border-bottom:none; border-left:.5pt solid silver; background:#CCFFFF; mso-pattern:auto none; white-space:nowrap;} .xl786153 {padding:0px; mso-ignore:padding; color:windowtext; font-size:8.0pt; font-weight:400; font-style:normal; text-decoration:none; font-family:Arial; mso-generic-font-family:auto; mso-font-charset:0; mso-number-format:General; text-align:center; vertical-align:bottom; border-top:none; border-right:.5pt solid silver; border-bottom:none; border-left:none; background:#CCFFFF; mso-pattern:auto none; white-space:nowrap;} .xl796153 {padding:0px; mso-ignore:padding; color:windowtext; font-size:10.0pt; font-weight:400; font-style:normal; text-decoration:none; font-family:Arial; mso-generic-font-family:auto; mso-font-charset:0; mso-number-format:General; text-align:center; vertical-align:middle; background:#CCFFFF; mso-pattern:auto none; white-space:nowrap;} .xl806153 {padding:0px; mso-ignore:padding; color:blue; font-size:10.0pt; font-weight:700; font-style:normal; text-decoration:underline; text-underline-style:single; font-family:Arial, sans-serif; mso-font-charset:0; mso-number-format:"\[ENG\]\[$-409\]d\\-mmm\\-yy\;\@"; text-align:center; vertical-align:middle; border-top:.5pt solid silver; border-right:none; border-bottom:none; border-left:.5pt solid silver; background:#CCFFFF; mso-pattern:auto none; white-space:nowrap;} .xl816153 {padding:0px; mso-ignore:padding; color:blue; font-size:10.0pt; font-weight:700; font-style:normal; text-decoration:underline; text-underline-style:single; font-family:Arial, sans-serif; mso-font-charset:0; mso-number-format:"\[ENG\]\[$-409\]d\\-mmm\\-yy\;\@"; text-align:center; vertical-align:middle; border-top:.5pt solid silver; border-right:none; border-bottom:none; border-left:none; background:#CCFFFF; mso-pattern:auto none; white-space:nowrap;} -->

A1: Global-View.com Chart Gallery
A2: 11/2//2011
A3: =NOW() -> 40849.39155925926 | B3: GMT | D3: 2yr | E3: bp | F3: 10yr | G3: bp | H3: DJIA | I3: 11657.96 | J3: 0
A4: USDX | B4: 7.9717000000000011 | C4: -8.1100000000000172 | D4: 0.2382 | E4: 0 | F4: 2.0505 | G4: 6.8600000000000136 | H4: S&P | I4: 1218 | J4: 0
B5: USD vs. | E5: Fixed Income | H5: NAS | I5: 2607 | J5: 3.999999999996362E-2
A6: EUR | B6: 1.3787 | C6: 87 | D6: 0.45600000000000002 | E6: 3.7 | F6: 1.83 | G6: 5.0999999999999943 | H6: DAX | I6: 5909.68 | J6: 75.170000000000073
A7: GBP | B7: 1.6029 | C7: 80 | D7: 0.56499999999999995 | E7: 1.5 | F7: 2.274 | G7: 2.9000000000000057 | H7: FTSE | I7: 5427 | J7: 5.430000000000291
A8: CHF | B8: 0.8821 | C8: -48 | D8: 7.2000000000000008E-2 | E8: 9.6 | F8: 0.93500000000000005 | G8: 1.5999999999999943 | H8: SMI | I8: 5609.96 | J8: 0
A9: JPY | B9: 78.04 | C9: -28 | D9: 0.15 | E9: -0.5 | F9: 1.00 | G9: -3 | H9: NIK | I9: 8640.42 | J9: -195.1
A10: CAD | B10: 1.0147999999999999 | C10: -20 | D10: 0.96599999999999997 | E10: 4.3999999999999915 | F10: 2.222 | G10: 6 | H10: TSE | I10: 12110 | J10: 0.28000000000065484
A11: AUD | B11: 1.0396000000000001 | C11: 49 | D11: 3.7069999999999999 | E11: 2.5 | F11: 4.298 | G11: 2 | H11: ASX | I11: 4184.64 | J11: -48.359999999999673
A12: NZD | B12: 0.79659999999999997 | C12: 14 | H12: HSI | I12: 19733.71 | J12: 363.75
A13: CNY | B13: 6.3550000000000004 | C13: 8 | H13: SSEC | I13: 2504 | J13: 34
B14: EUR vs. | E14: GBP vs. | I14: AUD vs
A15: JPY | B15: 107.59374800000001 | C15: 29.53479999999945 | D15: JPY | E15: 125.090316 | F15: 17.774800000001051 | H15: GBP | I15: 1.5407 | J15: -1.9999999999997797
A16: GBP | B16: 86.012851706282362 | C16: 11.404927352795369 | D16: CHF | E16: 141.39180899999999 | F16: -5.9872000000013941 | H16: CAD | I16: 1.0551999999999999 | J16: 31.999999999998696
A17: CHF | B17: 1.2161512699999999 | C17: 10.982699999998658 | D17: CAD | E17: 1.6263000000000001 | F17: 40.999999999999929 | H17: CHF | I17: 1.0907504363001745 | J17: 0.35680419898609372
A18: AUD | B18: 13257 | C18: 22 | E18: JPY vs. | H18: NZD | I18: 1.3046999999999999E-4 | J18: 5.1000000000001044E-3
A19: CAD | B19: 13993 | C19: 64 | D19: CHF | E19: 88.470694932547332 | F19: 16.310670388570259 | H19: Commodities
B20: CHF vs. | D20: CAD | E20: 33.65 | F20: 35.000000000000142 | H20: Gold | I20: 1730.99 | J20: 12.48
A21: CAD | B21: 1.0907504363001745 | C21: 3.5680419898609372 | D21: AUD | E21: 81.1 | F21: 3.9999999999992042 | H21: WTI | I21: 93.04 | J21: 1.78

A1: <!--//<![CDATA[ var m3_u = (location.protocol=='https:'?'https://gvads.blue105.us/Ads/www/delivery/ajs.php':'http://gvads.blue105.us/Ads/www/delivery/ajs.php'); var m3_r = Math.floor(Math.random()*99999999999); if (!document.MAX_used) document.MAX_used = ','; document.write ("<scr"+"ipt type='text/javascript' src='"+m3_u); document.write ("?zoneid=154"); document.write ('&amp;cb=' + m3_r); if (document.MAX_used != ',') document.write ("&amp;exclude=" + document.MAX_used); document.write (document.charset ? '&amp;charset='+document.charset : (document.characterSet ? '&amp;charset='+document.characterSet : '')); document.write ("&amp;loc=" + escape(window.location)); if (document.referrer) document.write ("&amp;referer=" + escape(document.referrer)); if (document.context) document.write ("&context=" + escape(document.context)); if (document.mmm_fo) document.write ("&amp;mmm_fo=1"); document.write ("'><\/scr"+"ipt>"); //]]>-->
A2: <!--//<![CDATA[ var m3_u = (location.protocol=='https:'?'https://gvads.blue105.us/Ads/www/delivery/ajs.php':'http://gvads.blue105.us/Ads/www/delivery/ajs.php'); var m3_r = Math.floor(Math.random()*99999999999); if (!document.MAX_used) document.MAX_used = ','; document.write ("<scr"+"ipt type='text/javascript' src='"+m3_u); document.write ("?zoneid=156"); document.write ('&amp;cb=' + m3_r); if (document.MAX_used != ',') document.write ("&amp;exclude=" + document.MAX_used); document.write (document.charset ? '&amp;charset='+document.charset : (document.characterSet ? '&amp;charset='+document.characterSet : '')); document.write ("&amp;loc=" + escape(window.location)); if (document.referrer) document.write ("&amp;referer=" + escape(document.referrer)); if (document.context) document.write ("&context=" + escape(document.context)); if (document.mmm_fo) document.write ("&amp;mmm_fo=1"); document.write ("'><\/scr"+"ipt>"); //]]>-->
A3: <!--//<![CDATA[ var m3_u = (location.protocol=='https:'?'https://gvads.blue105.us/Ads/www/delivery/ajs.php':'http://gvads.blue105.us/Ads/www/delivery/ajs.php'); var m3_r = Math.floor(Math.random()*99999999999); if (!document.MAX_used) document.MAX_used = ','; document.write ("<scr"+"ipt type='text/javascript' src='"+m3_u); document.write ("?zoneid=155"); document.write ('&amp;cb=' + m3_r); if (document.MAX_used != ',') document.write ("&amp;exclude=" + document.MAX_used); document.write (document.charset ? '&amp;charset='+document.charset : (document.characterSet ? '&amp;charset='+document.characterSet : '')); document.write ("&amp;loc=" + escape(window.location)); if (document.referrer) document.write ("&amp;referer=" + escape(document.referrer)); if (document.context) document.write ("&context=" + escape(document.context)); if (document.mmm_fo) document.write ("&amp;mmm_fo=1"); document.write ("'><\/scr"+"ipt>"); //]]>-->

A1: Forex Services -- Free Trials Global-View offers a full slate of currency exchange services. Real-time forex signals for trading. Trading Analysis and currency trading tips. FX charts and live forex news. Free trials Forex (currency trading) Services

A1: Forex Essentials in 15 Trades The Global-View.com Guide to Successful Currency Trading by John M. Bland Jay M. Meisler and Michael D. Archer

A1: Currency Trading Tools Live rates, currency news, fx charts. Research reports and currency forecasts. Foreign Exchange database and history. Weekly economic calendar. Directory of Forex trading tools

A1: MOST USED FOREX TRADING TOOLS
A2: FX Database: | B2: Chart Point Tables: | C2: By Base: | E2: CHF
A3: Your Charts | B3: Classic Format | C3: USD | D3: JPY | E3: AUD
A4: GVI Charts | B4: Risk Trades | C4: EUR | D4: GBP | E4: CAD
A5: Live Market Data | B5: Market Tracker | C5: Live USDX Chart

A1: Forex Forum Forex Trading Forum Forex Forum + forex rates Forex Forum Archives Forex Forum RSS Free Registration | B1: Trading Forums Currency Forum Guide Forum Directory Open Forum Futures Forum Political Forum | C1: Forex Brokers Compare Forex Brokers Forex Broker News Forex Broker Hotline Online Forex Trading
A2: Forex Trading Tools Currency Trading Tools Forex Database FX Chart Points Risk/Carry Trade Chart Points Economic Calendar Quicklinks to Economic Data Currency Futures Swaps Fibonacci Calculator Currency Futures Calculator | B2: Forex Education Forex Learning Center FX Trading Basics Course Forex Trading Course Forex Trading Handbook Forex Analysis Forex Forecasts Interest Rate Forecasts Central Bank Forecasts | C2: FX Charts and Quotes Live FX Rates Live Global Market Quotes Live Forex Charts US Dollar Index Chart Global Chart Gallery Daily Market Tracker
A3: Forex News Forex Blog Forex News Forex Blog Archives Forex News RSS | B3: Forex Services Forex Products GVI Forex Free Trials FX Bookstore | C3: FX Jobs and Careers Jobs USA Jobs UK Jobs Canada

A1: h4 { font-size:8pt; margin-bottom: 0px; } #footerText { font-size:8pt; } Forex Forum The Global-View Forex Forum is the hub for currency trading on the web. Founded in 1996, it was the original forex forum and is still the place where forex traders around the globe come 24/7 looking for currency trading ideas, breaking forex news, fx trading rumors, fx flows and more. This is where you can find a full suite of forex trading tools, including a complete fx database, forex chart points, live currency rates, and live fx charts. In addition, there is a forex brokers directory where you can compare forex brokers. There is also a forex brokers hotline where you can ask for help choosing a forex broker that meets your individual fx trading needs. Forex News The forex forum is where traders come to discuss the forex market. It is one of the few places where forex traders of all levels of experience, from novice to professionals, interact on the same venue to discuss forex trading. There is also the GVI Forex, which is a private subscription service where professional and experienced currency traders meet in a private forex forum. it is like a virtual forex trading room. This is open to forex traders of all levels of experience to view but only experienced currency tradingprofessionals can post. Currency Trading Currency trading charts are updated daily using the forex trading ranges posted in the Global-View forex database. You will also find technical indicators on the fx trading charts, e.g. moving averages for currencies such as the EURUSD. This is another forex trading tool provided by Global-View.com. Forex Brokers The forex database can be used to access high, low, close daily forex ranges for key currency pairs, such as the EURUSD, USDJPY, USDCHF, GBPUSD, USDCAD, AUD, NZD and major crosses, including EURJPY, EURGBP, EURCHF, GBPJPY, GBPCHF and CHFJPY. Data for these currency trading pairs dating back to January 1, 1999 can be downloaded to an Excel spreadsheet. Forex Trading Forex chart points are in a currency trading table that includes; latest fx tradinghigh-low-close range, Bollinger Bands, Fibonacci retracement levels, daily forex pivot points support and resistance levels, average daily forex range, MACD for the different currency trading pairs. You can look on the forex forum for updates when one of the fx trading tools is updated. FX Trading Global-View also offers a full fx trading chart gallery that includes fx pairs, such as the EURUSD, commodities, stocks and bonds. In a fx trading world where markets are integrated, the chart gallery is a valuable trading tool. Look for updates on the Forex Forum when the chart gallery is updated. Forex Blog Global-View.com also offers a forex blog, where articles of interest for currency trading are posted throughout the day. The forex blog articles come from outside sources, including forex brokers research as well as from the professionals at Global-View.com. This forex blog includes the Daily Forex View, Market Chatter and technical forex blog updates. In additional to its real time forex forum, there are also Member Forums available for more in depth forex trading discussions.